{
	"schema_version": 2,
	"id": "carry-an-arrow-around-a-loop",
	"title": "Carry an arrow around a loop",
	"kind": "interactive-3d",
	"priority": "flagship",
	"status": "proposed",
	"revision": 3,
	"updated": "2026-09-13",
	"component": null,
	"rungs": [
		"entry",
		"working"
	],
	"makes_visible": "An arrow carried around a loop without ever swinging comes back turned on a ball, but not on a flat floor or a rolled-up tube. On a ball the turn follows the area on the walker's left, wrapping around after a full turn, so the equator returns the arrow matching its start. The turn reverses when the loop is walked the other way. It is the one picture behind parallel transport, path dependence, holonomy, Gaussian curvature, and the meaning of the Riemann tensor.",
	"picture": {
		"caption": "Carry an arrow around a loop without letting it swing: on a ball it usually comes back turned, and on a flat sheet it never does.",
		"composition": "A shaded surface with a faint grid fills the scene. A loop is drawn on it, the region on the walker's left is lightly tinted, and small arrowheads along the loop show the walking direction. Faded copies of the carried arrow mark its progress. At the base point, an inset shows the starting arrow as a grey dashed line and the returned arrow as a solid orange line, with an arc between them. Readouts for the turn and the area appear only when the loop closes.",
		"elements": [
			{
				"element": "Surface with a faint grid",
				"depicts": "the world the walker lives on: flat floor, tube, ball, saddle, or cone"
			},
			{
				"element": "Loop with direction arrowheads",
				"depicts": "the path and which way it is walked"
			},
			{
				"element": "Tinted region on the walker's left",
				"depicts": "the region whose curvature sets the turn"
			},
			{
				"element": "Faded arrow copies along the loop",
				"depicts": "the arrow being carried without swinging"
			},
			{
				"element": "Base-point inset with a grey dashed start arrow and a solid orange returned arrow",
				"depicts": "the holonomy as the angle between two arrows at the same point"
			},
			{
				"element": "Readouts: turn, area, area over radius squared, angle excess",
				"depicts": "the area rule, shown only once the loop closes"
			}
		]
	},
	"print_figure": {
		"description": "Two panels. Left: a ball with the three-stretch loop from the North Pole, the arrow drawn on each stretch (ahead, right, behind), and an inset at the pole showing the dashed start arrow and the solid returned arrow a right angle apart. Right: a square walk on a flat sheet, where every arrow copy points the same way.",
		"labels": [
			"North Pole",
			"equator",
			"start",
			"return",
			"quarter turn",
			"flat sheet"
		],
		"aspect": "2:1",
		"alt_text": "On a ball, an arrow carried around a three-sided loop from the North Pole returns a quarter turn away from its start; on a flat sheet, an arrow carried around a square returns unchanged."
	},
	"variants": [
		{
			"id": "static-card",
			"form": "static",
			"description": "The print figure as an SVG card, used when 3D is unavailable and as a summary card.",
			"fallback": true
		},
		{
			"id": "unrolled-2d",
			"form": "interactive-2d",
			"description": "Unrolled views of the tube and the cone, where carrying the arrow is plain sliding and the seam adds any rotation.",
			"fallback": false
		},
		{
			"id": "full-3d",
			"form": "interactive-3d",
			"description": "The full experience on every surface, with presets, loop editing, reversal, radius changes, and scrubbing.",
			"fallback": false
		}
	],
	"params": [
		{
			"id": "surface",
			"label": "Surface",
			"type": "enum",
			"options": [
				{
					"value": "plane",
					"label": "Flat floor",
					"available_when": null
				},
				{
					"value": "tube",
					"label": "Tube",
					"available_when": null
				},
				{
					"value": "ball",
					"label": "Ball",
					"available_when": null
				},
				{
					"value": "saddle",
					"label": "Saddle",
					"available_when": null
				},
				{
					"value": "cone",
					"label": "Cone",
					"available_when": null
				}
			],
			"min": null,
			"max": null,
			"step": null,
			"unit": null,
			"default": "ball",
			"available_when": null,
			"effect": "Switches the surface; the loop is rebuilt on it."
		},
		{
			"id": "loop",
			"label": "Loop",
			"type": "enum",
			"options": [
				{
					"value": "octant-triangle",
					"label": "North Pole triangle",
					"available_when": {
						"surface": [
							"ball"
						]
					}
				},
				{
					"value": "square",
					"label": "Square",
					"available_when": {
						"surface": [
							"plane",
							"saddle"
						]
					}
				},
				{
					"value": "latitude-circle",
					"label": "Circle of latitude",
					"available_when": {
						"surface": [
							"ball"
						]
					}
				},
				{
					"value": "bracelet",
					"label": "Around the tube",
					"available_when": {
						"surface": [
							"tube"
						]
					}
				},
				{
					"value": "around-tip",
					"label": "Around the tip",
					"available_when": {
						"surface": [
							"cone"
						]
					}
				},
				{
					"value": "avoid-tip",
					"label": "Away from the tip",
					"available_when": {
						"surface": [
							"cone"
						]
					}
				},
				{
					"value": "two-routes",
					"label": "Two routes to one point",
					"available_when": {
						"surface": [
							"ball"
						]
					}
				},
				{
					"value": "free",
					"label": "Draw your own",
					"available_when": null
				}
			],
			"min": null,
			"max": null,
			"step": null,
			"unit": null,
			"default": "octant-triangle",
			"available_when": null,
			"effect": "Chooses the loop shape on the current surface. The square on the plane has side 0.4 scene units; on the saddle it is the projection of the square with corners at plus or minus 0.2R."
		},
		{
			"id": "direction",
			"label": "Walking direction",
			"type": "enum",
			"options": [
				{
					"value": "counterclockwise",
					"label": "Turning left (counterclockwise seen from outside)",
					"available_when": null
				},
				{
					"value": "clockwise",
					"label": "Turning right (clockwise seen from outside)",
					"available_when": null
				}
			],
			"min": null,
			"max": null,
			"step": null,
			"unit": null,
			"default": "counterclockwise",
			"available_when": null,
			"effect": "Reverses the walk; arrowheads, the tinted region, and the sign of the turn change together."
		},
		{
			"id": "area-fraction",
			"label": "Loop size",
			"type": "number",
			"options": null,
			"min": 0.05,
			"max": 1,
			"step": 0.05,
			"unit": null,
			"default": 1,
			"available_when": {
				"loop": [
					"octant-triangle",
					"square"
				]
			},
			"effect": "Scales the loop about its centroid, along geodesics, so that the enclosed area is this fraction of the preset shape's area."
		},
		{
			"id": "radius",
			"label": "Ball radius",
			"type": "number",
			"options": null,
			"min": 0.5,
			"max": 10,
			"step": 0.5,
			"unit": "scene units",
			"default": 1,
			"available_when": {
				"surface": [
					"ball"
				]
			},
			"effect": "Changes the ball's size; the loop keeps its angles."
		},
		{
			"id": "saddle-scale",
			"label": "Saddle scale R",
			"type": "number",
			"options": null,
			"min": 0.5,
			"max": 5,
			"step": 0.5,
			"unit": "scene units",
			"default": 1,
			"available_when": {
				"surface": [
					"saddle"
				]
			},
			"effect": "The saddle is z = (x² − y²)/(2R) over |x|, |y| ≤ 0.5R."
		},
		{
			"id": "colatitude",
			"label": "Colatitude",
			"type": "number",
			"options": null,
			"min": 5,
			"max": 175,
			"step": 1,
			"unit": "deg",
			"default": 50,
			"available_when": {
				"loop": [
					"latitude-circle"
				]
			},
			"effect": "Moves the circle of latitude, measured down from the North Pole; the circle is walked eastward."
		},
		{
			"id": "wedge-angle",
			"label": "Missing wedge",
			"type": "number",
			"options": null,
			"min": 0,
			"max": 300,
			"step": 5,
			"unit": "deg",
			"default": 60,
			"available_when": {
				"surface": [
					"cone"
				]
			},
			"effect": "Sets the wedge removed to make the cone."
		},
		{
			"id": "windings",
			"label": "Times around the tip",
			"type": "integer",
			"options": null,
			"min": 1,
			"max": 4,
			"step": 1,
			"unit": null,
			"default": 1,
			"available_when": {
				"loop": [
					"around-tip"
				]
			},
			"effect": "Repeats the loop around the cone's tip."
		},
		{
			"id": "progress",
			"label": "Walk progress",
			"type": "progress",
			"options": null,
			"min": 0,
			"max": 1,
			"step": 0.01,
			"unit": null,
			"default": 0,
			"available_when": null,
			"effect": "Moves the arrow along the loop; on-complete readouts appear only at 1."
		},
		{
			"id": "unrolled",
			"label": "Unroll",
			"type": "boolean",
			"options": null,
			"min": null,
			"max": null,
			"step": null,
			"unit": null,
			"default": false,
			"available_when": {
				"surface": [
					"tube",
					"cone"
				]
			},
			"effect": "Shows the flat sheet beside the tube or cone."
		},
		{
			"id": "path",
			"label": "Drawn loop",
			"type": "path",
			"options": null,
			"min": null,
			"max": null,
			"step": null,
			"unit": null,
			"default": null,
			"available_when": {
				"loop": [
					"free"
				]
			},
			"effect": "Vertices of a user-drawn loop."
		}
	],
	"presets": [
		{
			"id": "octant",
			"label": "North Pole triangle",
			"state": {
				"surface": "ball",
				"loop": "octant-triangle",
				"direction": "counterclockwise"
			}
		},
		{
			"id": "octant-reversed",
			"label": "North Pole triangle, walked the other way",
			"state": {
				"surface": "ball",
				"loop": "octant-triangle",
				"direction": "clockwise"
			}
		},
		{
			"id": "octant-half-area",
			"label": "Half-size triangle",
			"state": {
				"surface": "ball",
				"loop": "octant-triangle",
				"area-fraction": 0.5
			}
		},
		{
			"id": "latitude-circle",